event_id,event,ctx,dist,sentence_text,tags,entities,chunks
E:-2021156789,SIR model provides a general framework to understand the spread of a disease,guangdong province,22,"Abstract Background : An epidemic of a Severe Acute Respiratory Syndrome ( SARS ) caused by a new coronavirus has spread from the Guangdong province to the rest of China and to the world , with a puzzling contagion behavior .","JJ,NN,:,DT,JJ,IN,DT,JJ,JJ,JJ,NN,-LRB-,NN,-RRB-,VBN,IN,DT,JJ,NN,VBZ,VBN,IN,DT,NNP,NN,TO,DT,NN,IN,NNP,CC,TO,DT,NN,,,IN,DT,JJ,NN,NN,.","O,O,O,O,O,O,O,O,O,O,O,O,O,O,O,O,O,O,O,O,O,O,O,STATE_OR_PROVINCE,O,O,O,O,O,COUNTRY,O,O,O,O,O,O,O,O,O,O,O","B-NP,I-NP,O,B-NP,I-NP,B-PP,B-NP,I-NP,I-NP,I-NP,I-NP,I-NP,I-NP,I-NP,B-VP,B-PP,B-NP,I-NP,I-NP,B-VP,I-VP,B-PP,B-NP,I-NP,I-NP,B-PP,B-NP,I-NP,B-PP,B-NP,B-PP,B-PP,B-NP,I-NP,O,B-PP,B-NP,I-NP,I-NP,I-NP,O"
E:1207715975,SIR model provides a general framework to understand the spread of a disease,guangdong province,22,"Abstract Background : An epidemic of a Severe Acute Respiratory Syndrome ( SARS ) caused by a new coronavirus has spread from the Guangdong province to the rest of China and to the world , with a puzzling contagion behavior .","JJ,NN,:,DT,JJ,IN,DT,JJ,JJ,JJ,NN,-LRB-,NN,-RRB-,VBN,IN,DT,JJ,NN,VBZ,VBN,IN,DT,NNP,NN,TO,DT,NN,IN,NNP,CC,TO,DT,NN,,,IN,DT,JJ,NN,NN,.","O,O,O,O,O,O,O,O,O,O,O,O,O,O,O,O,O,O,O,O,O,O,O,STATE_OR_PROVINCE,O,O,O,O,O,COUNTRY,O,O,O,O,O,O,O,O,O,O,O","B-NP,I-NP,O,B-NP,I-NP,B-PP,B-NP,I-NP,I-NP,I-NP,I-NP,I-NP,I-NP,I-NP,B-VP,B-PP,B-NP,I-NP,I-NP,B-VP,I-VP,B-PP,B-NP,I-NP,I-NP,B-PP,B-NP,I-NP,B-PP,B-NP,B-PP,B-PP,B-NP,I-NP,O,B-PP,B-NP,I-NP,I-NP,I-NP,O"
E:489887684,most of the daily new number of  confirmed cases from the community stayed around 15 to 25,amoy gardens,0,"If we only consider those SARS cases from the community , i.e. we take away the number of confirmed SARS cases from the Amoy Gardens and those from the local hospitals , then most of the daily new number of confirmed cases from the community stayed around 15 to 25 ( of course this level went down after strong confinement directives were implemented by the Hong Kong government ) .","IN,PRP,RB,VBP,DT,NNS,NNS,IN,DT,NN,,,FW,PRP,VBP,RP,DT,NN,IN,VBN,NN,NNS,IN,DT,NNP,NNPS,CC,DT,IN,DT,JJ,NNS,,,RB,JJS,IN,DT,JJ,JJ,NN,IN,VBN,NNS,IN,DT,NN,VBD,IN,CD,TO,CD,-LRB-,IN,NN,DT,NN,VBD,RB,RB,JJ,NN,NNS,VBD,VBN,IN,DT,NNP,NNP,NN,-RRB-,.","O,O,O,O,O,O,O,O,O,O,O,O,O,O,O,O,O,O,O,O,O,O,O,LOCATION,LOCATION,O,O,O,O,O,O,O,O,O,O,O,SET,O,O,O,O,O,O,O,O,O,O,NUMBER,O,NUMBER,O,O,O,O,O,O,O,O,O,O,O,O,O,O,O,CITY,CITY,O,O,O","B-SBAR,B-NP,B-ADVP,B-VP,B-NP,I-NP,I-NP,B-PP,B-NP,I-NP,O,B-NP,B-NP,B-VP,B-ADVP,B-NP,I-NP,B-PP,B-NP,I-NP,I-NP,B-PP,B-NP,I-NP,I-NP,O,B-NP,B-PP,B-NP,I-NP,I-NP,O,B-ADVP,B-NP,B-PP,B-NP,I-NP,I-NP,I-NP,B-PP,B-NP,I-NP,B-PP,B-NP,I-NP,B-VP,B-PP,B-NP,I-NP,I-NP,I-NP,B-PP,B-NP,B-NP,I-NP,B-VP,B-ADVP,B-NP,I-NP,I-NP,I-NP,B-VP,I-VP,B-PP,B-NP,I-NP,I-NP,I-NP,I-NP,O"
E:600400887,I(0) = 10,amoy gardens,9,"If we take away those cases from the hospital staff and the Amoy Gardens Estate , that is if we only consider the cases from the community , then the graph looks closer to the general shape of a graph for a function I.","IN,PRP,VBP,RP,DT,NNS,IN,DT,NN,NN,CC,DT,NNP,NNP,NNP,,,DT,VBZ,IN,PRP,RB,VBP,DT,NNS,IN,DT,NN,,,RB,DT,NN,VBZ,JJR,TO,DT,JJ,NN,IN,DT,NN,IN,DT,NN,NN","O,O,O,O,O,O,O,O,O,O,O,O,LOCATION,LOCATION,LOCATION,O,O,O,O,O,O,O,O,O,O,O,O,O,O,O,O,O,O,O,O,TITLE,O,O,O,O,O,O,O,O","B-SBAR,B-NP,B-VP,B-PRT,B-NP,I-NP,B-PP,B-NP,I-NP,I-NP,O,B-NP,I-NP,I-NP,I-NP,O,B-NP,B-VP,B-SBAR,B-NP,B-ADVP,B-VP,B-NP,I-NP,B-PP,B-NP,I-NP,O,B-ADVP,B-NP,I-NP,B-VP,B-ADJP,B-PP,B-NP,I-NP,I-NP,B-PP,B-NP,I-NP,B-PP,B-NP,I-NP,I-NP"
E:928721260,r = 9.788 x 10-8,amoy gardens,9,"If we take away those cases from the hospital staff and the Amoy Gardens Estate , that is if we only consider the cases from the community , then the graph looks closer to the general shape of a graph for a function I.","IN,PRP,VBP,RP,DT,NNS,IN,DT,NN,NN,CC,DT,NNP,NNP,NNP,,,DT,VBZ,IN,PRP,RB,VBP,DT,NNS,IN,DT,NN,,,RB,DT,NN,VBZ,JJR,TO,DT,JJ,NN,IN,DT,NN,IN,DT,NN,NN","O,O,O,O,O,O,O,O,O,O,O,O,LOCATION,LOCATION,LOCATION,O,O,O,O,O,O,O,O,O,O,O,O,O,O,O,O,O,O,O,O,TITLE,O,O,O,O,O,O,O,O","B-SBAR,B-NP,B-VP,B-PRT,B-NP,I-NP,B-PP,B-NP,I-NP,I-NP,O,B-NP,I-NP,I-NP,I-NP,O,B-NP,B-VP,B-SBAR,B-NP,B-ADVP,B-VP,B-NP,I-NP,B-PP,B-NP,I-NP,O,B-ADVP,B-NP,I-NP,B-VP,B-ADJP,B-PP,B-NP,I-NP,I-NP,B-PP,B-NP,I-NP,B-PP,B-NP,I-NP,I-NP"
E:1751271620,a = 2/3,amoy gardens,9,"If we take away those cases from the hospital staff and the Amoy Gardens Estate , that is if we only consider the cases from the community , then the graph looks closer to the general shape of a graph for a function I.","IN,PRP,VBP,RP,DT,NNS,IN,DT,NN,NN,CC,DT,NNP,NNP,NNP,,,DT,VBZ,IN,PRP,RB,VBP,DT,NNS,IN,DT,NN,,,RB,DT,NN,VBZ,JJR,TO,DT,JJ,NN,IN,DT,NN,IN,DT,NN,NN","O,O,O,O,O,O,O,O,O,O,O,O,LOCATION,LOCATION,LOCATION,O,O,O,O,O,O,O,O,O,O,O,O,O,O,O,O,O,O,O,O,TITLE,O,O,O,O,O,O,O,O","B-SBAR,B-NP,B-VP,B-PRT,B-NP,I-NP,B-PP,B-NP,I-NP,I-NP,O,B-NP,I-NP,I-NP,I-NP,O,B-NP,B-VP,B-SBAR,B-NP,B-ADVP,B-VP,B-NP,I-NP,B-PP,B-NP,I-NP,O,B-ADVP,B-NP,I-NP,B-VP,B-ADJP,B-PP,B-NP,I-NP,I-NP,B-PP,B-NP,I-NP,B-PP,B-NP,I-NP,I-NP"
E:2011078989,apply our model to study the outbreak of  SARS in Hong Kong,amoy gardens,2,"Figure 2 Daily new number of confirmed SARS cases from Hong Kong : hospital , community and the Amoy Gardens Daily new number of confirmed SARS cases from Hong Kong : hospital , community and the Amoy Gardens .","NN,CD,NNP,JJ,NN,IN,VBN,NN,NNS,IN,NNP,NNP,:,NN,,,NN,CC,DT,NNP,NNP,NNP,JJ,NN,IN,VBN,NN,NNS,IN,NNP,NNP,:,NN,,,NN,CC,DT,NNP,NNPS,.","O,NUMBER,SET,O,O,O,O,O,O,O,CITY,CITY,O,O,O,O,O,O,ORGANIZATION,ORGANIZATION,ORGANIZATION,O,O,O,O,O,O,O,CITY,CITY,O,O,O,O,O,O,LOCATION,LOCATION,O","B-NP,I-NP,I-NP,I-NP,I-NP,B-PP,B-NP,I-NP,I-NP,B-PP,B-NP,I-NP,O,B-NP,O,B-NP,O,B-NP,I-NP,I-NP,I-NP,I-NP,I-NP,B-PP,B-NP,I-NP,I-NP,B-PP,B-NP,I-NP,O,B-NP,O,B-NP,O,B-NP,I-NP,I-NP,O"
E:-2099349734,set of coronavirus mediated epidemics that affected pigs,china,39,"Results In this paper , we introduce a new epidemic model to study the outbreak of SARS in China .","NNS,IN,DT,NN,,,PRP,VBP,DT,JJ,JJ,NN,TO,VB,DT,NN,IN,NNP,IN,NNP,.","O,O,O,O,O,O,O,O,O,O,TITLE,O,O,O,O,O,O,O,COUNTRY,O","B-NP,B-PP,B-NP,I-NP,O,B-NP,B-VP,B-NP,I-NP,I-NP,I-NP,B-VP,I-VP,B-NP,I-NP,B-PP,B-NP,B-PP,B-NP,O"
E:-234630779,"It is based on the high mutation and  recombination rate of  coronaviruses [2], and on the observation",china,41,"Results In this paper , we introduce a new epidemic model to study the outbreak of SARS in China .","NNS,IN,DT,NN,,,PRP,VBP,DT,JJ,JJ,NN,TO,VB,DT,NN,IN,NNP,IN,NNP,.","O,O,O,O,O,O,O,O,O,O,TITLE,O,O,O,O,O,O,O,COUNTRY,O","B-NP,B-PP,B-NP,I-NP,O,B-NP,B-VP,B-NP,I-NP,I-NP,I-NP,B-VP,I-VP,B-NP,I-NP,B-PP,B-NP,B-PP,B-NP,O"
E:-978116680,it would cause gastroenteritis,china,44,"Results In this paper , we introduce a new epidemic model to study the outbreak of SARS in China .","NNS,IN,DT,NN,,,PRP,VBP,DT,JJ,JJ,NN,TO,VB,DT,NN,IN,NNP,IN,NNP,.","O,O,O,O,O,O,O,O,O,O,TITLE,O,O,O,O,O,O,O,COUNTRY,O","B-NP,B-PP,B-NP,I-NP,O,B-NP,B-VP,B-NP,I-NP,I-NP,I-NP,B-VP,I-VP,B-NP,I-NP,B-PP,B-NP,B-PP,B-NP,O"
E:133243356,"We also explore the possible situation where  viruses A and  B would be of totally different origin, but would cause an overlapping immune response of  the host",china,46,"Results In this paper , we introduce a new epidemic model to study the outbreak of SARS in China .","NNS,IN,DT,NN,,,PRP,VBP,DT,JJ,JJ,NN,TO,VB,DT,NN,IN,NNP,IN,NNP,.","O,O,O,O,O,O,O,O,O,O,TITLE,O,O,O,O,O,O,O,COUNTRY,O","B-NP,B-PP,B-NP,I-NP,O,B-NP,B-VP,B-NP,I-NP,I-NP,I-NP,B-VP,I-VP,B-NP,I-NP,B-PP,B-NP,B-PP,B-NP,O"
E:688032372,R increases,china,34,"Results In this paper , we introduce a new epidemic model to study the outbreak of SARS in China .","NNS,IN,DT,NN,,,PRP,VBP,DT,JJ,JJ,NN,TO,VB,DT,NN,IN,NNP,IN,NNP,.","O,O,O,O,O,O,O,O,O,O,TITLE,O,O,O,O,O,O,O,COUNTRY,O","B-NP,B-PP,B-NP,I-NP,O,B-NP,B-VP,B-NP,I-NP,I-NP,I-NP,B-VP,I-VP,B-NP,I-NP,B-PP,B-NP,B-PP,B-NP,O"
E:326251251,S decreases,china,34,"Results In this paper , we introduce a new epidemic model to study the outbreak of SARS in China .","NNS,IN,DT,NN,,,PRP,VBP,DT,JJ,JJ,NN,TO,VB,DT,NN,IN,NNP,IN,NNP,.","O,O,O,O,O,O,O,O,O,O,TITLE,O,O,O,O,O,O,O,COUNTRY,O","B-NP,B-PP,B-NP,I-NP,O,B-NP,B-VP,B-NP,I-NP,I-NP,I-NP,B-VP,I-VP,B-NP,I-NP,B-PP,B-NP,B-PP,B-NP,O"
E:2118226924,R0>1,china,8,"Results In this paper , we introduce a new epidemic model to study the outbreak of SARS in China .","NNS,IN,DT,NN,,,PRP,VBP,DT,JJ,JJ,NN,TO,VB,DT,NN,IN,NNP,IN,NNP,.","O,O,O,O,O,O,O,O,O,O,TITLE,O,O,O,O,O,O,O,COUNTRY,O","B-NP,B-PP,B-NP,I-NP,O,B-NP,B-VP,B-NP,I-NP,I-NP,I-NP,B-VP,I-VP,B-NP,I-NP,B-PP,B-NP,B-PP,B-NP,O"
E:568001232,the so called Susceptible-Infected-Removed (SIR) model which is simple and useful when one tries to understand the propagation of many real-life epidemics,china,1,"Results In this paper , we introduce a new epidemic model to study the outbreak of SARS in China .","NNS,IN,DT,NN,,,PRP,VBP,DT,JJ,JJ,NN,TO,VB,DT,NN,IN,NNP,IN,NNP,.","O,O,O,O,O,O,O,O,O,O,TITLE,O,O,O,O,O,O,O,COUNTRY,O","B-NP,B-PP,B-NP,I-NP,O,B-NP,B-VP,B-NP,I-NP,I-NP,I-NP,B-VP,I-VP,B-NP,I-NP,B-PP,B-NP,B-PP,B-NP,O"
E:1717829459,new model is still relatively simple,china,3,"Results In this paper , we introduce a new epidemic model to study the outbreak of SARS in China .","NNS,IN,DT,NN,,,PRP,VBP,DT,JJ,JJ,NN,TO,VB,DT,NN,IN,NNP,IN,NNP,.","O,O,O,O,O,O,O,O,O,O,TITLE,O,O,O,O,O,O,O,COUNTRY,O","B-NP,B-PP,B-NP,I-NP,O,B-NP,B-VP,B-NP,I-NP,I-NP,I-NP,B-VP,I-VP,B-NP,I-NP,B-PP,B-NP,B-PP,B-NP,O"
E:-842756165,the standard Susceptible-Infected-Removed (SIR) model cannot account for the patterns observed in various regions where the disease spread,china,25,"Address : 1Department of Mathematics , the University of Hong Kong , Hong Kong , China , 2Inria Rocquencourt Domaine de Voluceau , Rocquencourt , France , 3Centre d'Enseignement Et de Recherche En Mathematiques , Informatique et Calcul Scientifique-ENPC , Marne La Vallee , France and 4Genetique des Genomes Bacteriens , Institut Pasteur , Paris , France .","NN,:,NN,IN,NNP,,,DT,NNP,IN,NNP,NNP,,,NNP,NNP,,,NNP,,,NNP,NNP,NNP,IN,NNP,,,NNP,,,NNP,,,NNP,NNP,NNP,IN,NNP,NNP,NNP,,,NNP,FW,FW,NN,,,NNP,NNP,NNP,,,NNP,CC,NNP,NNP,NNP,NNP,,,NNP,NNP,,,NNP,,,NNP,.","O,O,O,O,MISC,O,O,ORGANIZATION,ORGANIZATION,ORGANIZATION,ORGANIZATION,O,CITY,CITY,O,COUNTRY,O,O,PERSON,PERSON,PERSON,PERSON,O,LOCATION,O,COUNTRY,O,O,O,O,O,ORGANIZATION,ORGANIZATION,ORGANIZATION,ORGANIZATION,ORGANIZATION,O,MISC,MISC,O,PERSON,PERSON,PERSON,O,COUNTRY,O,O,O,O,O,O,ORGANIZATION,ORGANIZATION,O,CITY,O,COUNTRY,O","B-NP,O,B-NP,B-PP,B-NP,O,B-NP,I-NP,B-PP,B-NP,I-NP,O,B-NP,I-NP,O,B-NP,O,B-NP,I-NP,I-NP,I-NP,I-NP,I-NP,I-NP,I-NP,I-NP,I-NP,I-NP,I-NP,I-NP,B-PP,B-NP,I-NP,I-NP,O,B-NP,I-NP,I-NP,I-NP,O,B-NP,I-NP,I-NP,O,B-NP,O,B-NP,I-NP,I-NP,I-NP,O,B-NP,I-NP,O,B-NP,O,B-NP,O"
E:35628357,relation rS(t0) = a holds,china,13,"This outbreak started a world-wide epidemic after a medical doctor from Guangzhou infected several persons at an hotel in Kowloon around February 21st , 2003 ( SAR Hong Kong , China ) .","DT,NN,VBD,DT,JJ,JJ,IN,DT,JJ,NN,IN,NNP,JJ,JJ,NNS,IN,DT,NN,IN,NNP,IN,NNP,CD,,,CD,-LRB-,NNP,NNP,NNP,,,NNP,-RRB-,.","O,O,O,O,O,O,O,O,O,TITLE,O,CITY,O,O,O,O,O,O,O,LOCATION,O,DATE,DATE,DATE,DATE,O,O,CITY,CITY,O,COUNTRY,O,O","B-NP,I-NP,B-VP,B-NP,I-NP,I-NP,B-PP,B-NP,I-NP,I-NP,B-PP,B-NP,I-NP,I-NP,I-NP,B-PP,B-NP,I-NP,B-PP,B-NP,B-PP,B-NP,I-NP,I-NP,I-NP,I-NP,I-NP,I-NP,I-NP,O,B-NP,I-NP,O"
E:-2060872575,t0 is the critical point of the function,china,60,"Abstract Background : An epidemic of a Severe Acute Respiratory Syndrome ( SARS ) caused by a new coronavirus has spread from the Guangdong province to the rest of China and to the world , with a puzzling contagion behavior .","JJ,NN,:,DT,JJ,IN,DT,JJ,JJ,JJ,NN,-LRB-,NN,-RRB-,VBN,IN,DT,JJ,NN,VBZ,VBN,IN,DT,NNP,NN,TO,DT,NN,IN,NNP,CC,TO,DT,NN,,,IN,DT,JJ,NN,NN,.","O,O,O,O,O,O,O,O,O,O,O,O,O,O,O,O,O,O,O,O,O,O,O,STATE_OR_PROVINCE,O,O,O,O,O,COUNTRY,O,O,O,O,O,O,O,O,O,O,O","B-NP,I-NP,O,B-NP,I-NP,B-PP,B-NP,I-NP,I-NP,I-NP,I-NP,I-NP,I-NP,I-NP,B-VP,B-PP,B-NP,I-NP,I-NP,B-VP,I-VP,B-PP,B-NP,I-NP,I-NP,B-PP,B-NP,I-NP,B-PP,B-NP,B-PP,B-PP,B-NP,I-NP,O,B-PP,B-NP,I-NP,I-NP,I-NP,O"
E:-258051935,t0 is the critical point of the function,china,60,"Abstract Background : An epidemic of a Severe Acute Respiratory Syndrome ( SARS ) caused by a new coronavirus has spread from the Guangdong province to the rest of China and to the world , with a puzzling contagion behavior .","JJ,NN,:,DT,JJ,IN,DT,JJ,JJ,JJ,NN,-LRB-,NN,-RRB-,VBN,IN,DT,JJ,NN,VBZ,VBN,IN,DT,NNP,NN,TO,DT,NN,IN,NNP,CC,TO,DT,NN,,,IN,DT,JJ,NN,NN,.","O,O,O,O,O,O,O,O,O,O,O,O,O,O,O,O,O,O,O,O,O,O,O,STATE_OR_PROVINCE,O,O,O,O,O,COUNTRY,O,O,O,O,O,O,O,O,O,O,O","B-NP,I-NP,O,B-NP,I-NP,B-PP,B-NP,I-NP,I-NP,I-NP,I-NP,I-NP,I-NP,I-NP,B-VP,B-PP,B-NP,I-NP,I-NP,B-VP,I-VP,B-PP,B-NP,I-NP,I-NP,B-PP,B-NP,I-NP,B-PP,B-NP,B-PP,B-PP,B-NP,I-NP,O,B-PP,B-NP,I-NP,I-NP,I-NP,O"
E:-1139992441,"infectives, I,",china,89,"Abstract Background : An epidemic of a Severe Acute Respiratory Syndrome ( SARS ) caused by a new coronavirus has spread from the Guangdong province to the rest of China and to the world , with a puzzling contagion behavior .","JJ,NN,:,DT,JJ,IN,DT,JJ,JJ,JJ,NN,-LRB-,NN,-RRB-,VBN,IN,DT,JJ,NN,VBZ,VBN,IN,DT,NNP,NN,TO,DT,NN,IN,NNP,CC,TO,DT,NN,,,IN,DT,JJ,NN,NN,.","O,O,O,O,O,O,O,O,O,O,O,O,O,O,O,O,O,O,O,O,O,O,O,STATE_OR_PROVINCE,O,O,O,O,O,COUNTRY,O,O,O,O,O,O,O,O,O,O,O","B-NP,I-NP,O,B-NP,I-NP,B-PP,B-NP,I-NP,I-NP,I-NP,I-NP,I-NP,I-NP,I-NP,B-VP,B-PP,B-NP,I-NP,I-NP,B-VP,I-VP,B-PP,B-NP,I-NP,I-NP,B-PP,B-NP,I-NP,B-PP,B-NP,B-PP,B-PP,B-NP,I-NP,O,B-PP,B-NP,I-NP,I-NP,I-NP,O"
E:-403628784,"susceptibles, S,",china,89,"Abstract Background : An epidemic of a Severe Acute Respiratory Syndrome ( SARS ) caused by a new coronavirus has spread from the Guangdong province to the rest of China and to the world , with a puzzling contagion behavior .","JJ,NN,:,DT,JJ,IN,DT,JJ,JJ,JJ,NN,-LRB-,NN,-RRB-,VBN,IN,DT,JJ,NN,VBZ,VBN,IN,DT,NNP,NN,TO,DT,NN,IN,NNP,CC,TO,DT,NN,,,IN,DT,JJ,NN,NN,.","O,O,O,O,O,O,O,O,O,O,O,O,O,O,O,O,O,O,O,O,O,O,O,STATE_OR_PROVINCE,O,O,O,O,O,COUNTRY,O,O,O,O,O,O,O,O,O,O,O","B-NP,I-NP,O,B-NP,I-NP,B-PP,B-NP,I-NP,I-NP,I-NP,I-NP,I-NP,I-NP,I-NP,B-VP,B-PP,B-NP,I-NP,I-NP,B-VP,I-VP,B-PP,B-NP,I-NP,I-NP,B-PP,B-NP,I-NP,B-PP,B-NP,B-PP,B-PP,B-NP,I-NP,O,B-PP,B-NP,I-NP,I-NP,I-NP,O"
E:-288683903,"S(t), I(t) and R(t) be the number of individuals in each of the corresponding class at time t. Note",china,92,"Abstract Background : An epidemic of a Severe Acute Respiratory Syndrome ( SARS ) caused by a new coronavirus has spread from the Guangdong province to the rest of China and to the world , with a puzzling contagion behavior .","JJ,NN,:,DT,JJ,IN,DT,JJ,JJ,JJ,NN,-LRB-,NN,-RRB-,VBN,IN,DT,JJ,NN,VBZ,VBN,IN,DT,NNP,NN,TO,DT,NN,IN,NNP,CC,TO,DT,NN,,,IN,DT,JJ,NN,NN,.","O,O,O,O,O,O,O,O,O,O,O,O,O,O,O,O,O,O,O,O,O,O,O,STATE_OR_PROVINCE,O,O,O,O,O,COUNTRY,O,O,O,O,O,O,O,O,O,O,O","B-NP,I-NP,O,B-NP,I-NP,B-PP,B-NP,I-NP,I-NP,I-NP,I-NP,I-NP,I-NP,I-NP,B-VP,B-PP,B-NP,I-NP,I-NP,B-VP,I-VP,B-PP,B-NP,I-NP,I-NP,B-PP,B-NP,I-NP,B-PP,B-NP,B-PP,B-PP,B-NP,I-NP,O,B-PP,B-NP,I-NP,I-NP,I-NP,O"
E:-1509583947,I(t) and R(t) be the number of individuals in each of the corresponding class at time t. Note,china,92,"Abstract Background : An epidemic of a Severe Acute Respiratory Syndrome ( SARS ) caused by a new coronavirus has spread from the Guangdong province to the rest of China and to the world , with a puzzling contagion behavior .","JJ,NN,:,DT,JJ,IN,DT,JJ,JJ,JJ,NN,-LRB-,NN,-RRB-,VBN,IN,DT,JJ,NN,VBZ,VBN,IN,DT,NNP,NN,TO,DT,NN,IN,NNP,CC,TO,DT,NN,,,IN,DT,JJ,NN,NN,.","O,O,O,O,O,O,O,O,O,O,O,O,O,O,O,O,O,O,O,O,O,O,O,STATE_OR_PROVINCE,O,O,O,O,O,COUNTRY,O,O,O,O,O,O,O,O,O,O,O","B-NP,I-NP,O,B-NP,I-NP,B-PP,B-NP,I-NP,I-NP,I-NP,I-NP,I-NP,I-NP,I-NP,B-VP,B-PP,B-NP,I-NP,I-NP,B-VP,I-VP,B-PP,B-NP,I-NP,I-NP,B-PP,B-NP,I-NP,B-PP,B-NP,B-PP,B-PP,B-NP,I-NP,O,B-PP,B-NP,I-NP,I-NP,I-NP,O"
E:367164955,R(t) be the number of individuals in each of the corresponding class at time t. Note,china,92,"Abstract Background : An epidemic of a Severe Acute Respiratory Syndrome ( SARS ) caused by a new coronavirus has spread from the Guangdong province to the rest of China and to the world , with a puzzling contagion behavior .","JJ,NN,:,DT,JJ,IN,DT,JJ,JJ,JJ,NN,-LRB-,NN,-RRB-,VBN,IN,DT,JJ,NN,VBZ,VBN,IN,DT,NNP,NN,TO,DT,NN,IN,NNP,CC,TO,DT,NN,,,IN,DT,JJ,NN,NN,.","O,O,O,O,O,O,O,O,O,O,O,O,O,O,O,O,O,O,O,O,O,O,O,STATE_OR_PROVINCE,O,O,O,O,O,COUNTRY,O,O,O,O,O,O,O,O,O,O,O","B-NP,I-NP,O,B-NP,I-NP,B-PP,B-NP,I-NP,I-NP,I-NP,I-NP,I-NP,I-NP,I-NP,B-VP,B-PP,B-NP,I-NP,I-NP,B-VP,I-VP,B-PP,B-NP,I-NP,I-NP,B-PP,B-NP,I-NP,B-PP,B-NP,B-PP,B-PP,B-NP,I-NP,O,B-PP,B-NP,I-NP,I-NP,I-NP,O"
E:-253766216,R(t) is the cumulative number of  patients admitted to hospitals,china,93,"Abstract Background : An epidemic of a Severe Acute Respiratory Syndrome ( SARS ) caused by a new coronavirus has spread from the Guangdong province to the rest of China and to the world , with a puzzling contagion behavior .","JJ,NN,:,DT,JJ,IN,DT,JJ,JJ,JJ,NN,-LRB-,NN,-RRB-,VBN,IN,DT,JJ,NN,VBZ,VBN,IN,DT,NNP,NN,TO,DT,NN,IN,NNP,CC,TO,DT,NN,,,IN,DT,JJ,NN,NN,.","O,O,O,O,O,O,O,O,O,O,O,O,O,O,O,O,O,O,O,O,O,O,O,STATE_OR_PROVINCE,O,O,O,O,O,COUNTRY,O,O,O,O,O,O,O,O,O,O,O","B-NP,I-NP,O,B-NP,I-NP,B-PP,B-NP,I-NP,I-NP,I-NP,I-NP,I-NP,I-NP,I-NP,B-VP,B-PP,B-NP,I-NP,I-NP,B-VP,I-VP,B-PP,B-NP,I-NP,I-NP,B-PP,B-NP,I-NP,B-PP,B-NP,B-PP,B-PP,B-NP,I-NP,O,B-PP,B-NP,I-NP,I-NP,I-NP,O"
E:1870125202,It is of ten,china,93,"Abstract Background : An epidemic of a Severe Acute Respiratory Syndrome ( SARS ) caused by a new coronavirus has spread from the Guangdong province to the rest of China and to the world , with a puzzling contagion behavior .","JJ,NN,:,DT,JJ,IN,DT,JJ,JJ,JJ,NN,-LRB-,NN,-RRB-,VBN,IN,DT,JJ,NN,VBZ,VBN,IN,DT,NNP,NN,TO,DT,NN,IN,NNP,CC,TO,DT,NN,,,IN,DT,JJ,NN,NN,.","O,O,O,O,O,O,O,O,O,O,O,O,O,O,O,O,O,O,O,O,O,O,O,STATE_OR_PROVINCE,O,O,O,O,O,COUNTRY,O,O,O,O,O,O,O,O,O,O,O","B-NP,I-NP,O,B-NP,I-NP,B-PP,B-NP,I-NP,I-NP,I-NP,I-NP,I-NP,I-NP,I-NP,B-VP,B-PP,B-NP,I-NP,I-NP,B-VP,I-VP,B-PP,B-NP,I-NP,I-NP,B-PP,B-NP,I-NP,B-PP,B-NP,B-PP,B-PP,B-NP,I-NP,O,B-PP,B-NP,I-NP,I-NP,I-NP,O"
E:1117868815,three functions are governed by the following system of  nonlinear ordinary differential equations,china,94,"Abstract Background : An epidemic of a Severe Acute Respiratory Syndrome ( SARS ) caused by a new coronavirus has spread from the Guangdong province to the rest of China and to the world , with a puzzling contagion behavior .","JJ,NN,:,DT,JJ,IN,DT,JJ,JJ,JJ,NN,-LRB-,NN,-RRB-,VBN,IN,DT,JJ,NN,VBZ,VBN,IN,DT,NNP,NN,TO,DT,NN,IN,NNP,CC,TO,DT,NN,,,IN,DT,JJ,NN,NN,.","O,O,O,O,O,O,O,O,O,O,O,O,O,O,O,O,O,O,O,O,O,O,O,STATE_OR_PROVINCE,O,O,O,O,O,COUNTRY,O,O,O,O,O,O,O,O,O,O,O","B-NP,I-NP,O,B-NP,I-NP,B-PP,B-NP,I-NP,I-NP,I-NP,I-NP,I-NP,I-NP,I-NP,B-VP,B-PP,B-NP,I-NP,I-NP,B-VP,I-VP,B-PP,B-NP,I-NP,I-NP,B-PP,B-NP,I-NP,B-PP,B-NP,B-PP,B-PP,B-NP,I-NP,O,B-PP,B-NP,I-NP,I-NP,I-NP,O"
E:-909761626,r is the infection rate,china,15,"Abstract Background : An epidemic of a Severe Acute Respiratory Syndrome ( SARS ) caused by a new coronavirus has spread from the Guangdong province to the rest of China and to the world , with a puzzling contagion behavior .","JJ,NN,:,DT,JJ,IN,DT,JJ,JJ,JJ,NN,-LRB-,NN,-RRB-,VBN,IN,DT,JJ,NN,VBZ,VBN,IN,DT,NNP,NN,TO,DT,NN,IN,NNP,CC,TO,DT,NN,,,IN,DT,JJ,NN,NN,.","O,O,O,O,O,O,O,O,O,O,O,O,O,O,O,O,O,O,O,O,O,O,O,STATE_OR_PROVINCE,O,O,O,O,O,COUNTRY,O,O,O,O,O,O,O,O,O,O,O","B-NP,I-NP,O,B-NP,I-NP,B-PP,B-NP,I-NP,I-NP,I-NP,I-NP,I-NP,I-NP,I-NP,B-VP,B-PP,B-NP,I-NP,I-NP,B-VP,I-VP,B-PP,B-NP,I-NP,I-NP,B-PP,B-NP,I-NP,B-PP,B-NP,B-PP,B-PP,B-NP,I-NP,O,B-PP,B-NP,I-NP,I-NP,I-NP,O"
E:1892020837,many possibilities based on virus behavior,inner mongolia,43,The usual number of social contacts of a person is in general higher in big cities like Beijing and Hong Kong while lower in remote area like Inner Mongolia .,"DT,JJ,NN,IN,JJ,NNS,IN,DT,NN,VBZ,IN,JJ,JJR,IN,JJ,NNS,IN,NNP,CC,NNP,NNP,IN,JJR,IN,JJ,NN,IN,NNP,NNP,.","O,O,O,O,O,O,O,O,O,O,O,TITLE,O,O,O,O,O,CITY,O,CITY,CITY,O,O,O,O,O,O,STATE_OR_PROVINCE,STATE_OR_PROVINCE,O","B-NP,I-NP,I-NP,B-PP,B-NP,I-NP,B-PP,B-NP,I-NP,B-VP,B-PP,B-ADJP,B-ADVP,B-PP,B-NP,I-NP,B-PP,B-NP,I-NP,I-NP,I-NP,B-SBAR,B-ADVP,B-PP,B-NP,I-NP,B-PP,B-NP,I-NP,O"
E:527339462,"SARS [14], a coronavirus",inner mongolia,46,The usual number of social contacts of a person is in general higher in big cities like Beijing and Hong Kong while lower in remote area like Inner Mongolia .,"DT,JJ,NN,IN,JJ,NNS,IN,DT,NN,VBZ,IN,JJ,JJR,IN,JJ,NNS,IN,NNP,CC,NNP,NNP,IN,JJR,IN,JJ,NN,IN,NNP,NNP,.","O,O,O,O,O,O,O,O,O,O,O,TITLE,O,O,O,O,O,CITY,O,CITY,CITY,O,O,O,O,O,O,STATE_OR_PROVINCE,STATE_OR_PROVINCE,O","B-NP,I-NP,I-NP,B-PP,B-NP,I-NP,B-PP,B-NP,I-NP,B-VP,B-PP,B-ADJP,B-ADVP,B-PP,B-NP,I-NP,B-PP,B-NP,I-NP,I-NP,I-NP,B-SBAR,B-ADVP,B-PP,B-NP,I-NP,B-PP,B-NP,I-NP,O"
E:1600242282,virus and its variant caused a double epidemic,inner mongolia,46,The usual number of social contacts of a person is in general higher in big cities like Beijing and Hong Kong while lower in remote area like Inner Mongolia .,"DT,JJ,NN,IN,JJ,NNS,IN,DT,NN,VBZ,IN,JJ,JJR,IN,JJ,NNS,IN,NNP,CC,NNP,NNP,IN,JJR,IN,JJ,NN,IN,NNP,NNP,.","O,O,O,O,O,O,O,O,O,O,O,TITLE,O,O,O,O,O,CITY,O,CITY,CITY,O,O,O,O,O,O,STATE_OR_PROVINCE,STATE_OR_PROVINCE,O","B-NP,I-NP,I-NP,B-PP,B-NP,I-NP,B-PP,B-NP,I-NP,B-VP,B-PP,B-ADJP,B-ADVP,B-PP,B-NP,I-NP,B-PP,B-NP,I-NP,I-NP,I-NP,B-SBAR,B-ADVP,B-PP,B-NP,I-NP,B-PP,B-NP,I-NP,O"
E:-1787604617,nature of the virus that causes SARS,inner mongolia,46,The usual number of social contacts of a person is in general higher in big cities like Beijing and Hong Kong while lower in remote area like Inner Mongolia .,"DT,JJ,NN,IN,JJ,NNS,IN,DT,NN,VBZ,IN,JJ,JJR,IN,JJ,NNS,IN,NNP,CC,NNP,NNP,IN,JJR,IN,JJ,NN,IN,NNP,NNP,.","O,O,O,O,O,O,O,O,O,O,O,TITLE,O,O,O,O,O,CITY,O,CITY,CITY,O,O,O,O,O,O,STATE_OR_PROVINCE,STATE_OR_PROVINCE,O","B-NP,I-NP,I-NP,B-PP,B-NP,I-NP,B-PP,B-NP,I-NP,B-VP,B-PP,B-ADJP,B-ADVP,B-PP,B-NP,I-NP,B-PP,B-NP,I-NP,I-NP,I-NP,B-SBAR,B-ADVP,B-PP,B-NP,I-NP,B-PP,B-NP,I-NP,O"
E:-206725614,it is then rather related to the health policy than to the disease,inner mongolia,17,Figure 10 Cumulative number of SARS cases in Inner Mongolia Cumulative number of SARS cases in Inner Mongolia .,"NNP,CD,JJ,NN,IN,NN,NNS,IN,NNP,NNP,JJ,NN,IN,NN,NNS,IN,NNP,NNP,.","O,NUMBER,O,O,O,O,O,O,STATE_OR_PROVINCE,STATE_OR_PROVINCE,O,O,O,O,O,O,STATE_OR_PROVINCE,STATE_OR_PROVINCE,O","B-NP,I-NP,I-NP,I-NP,B-PP,B-NP,I-NP,B-PP,B-NP,I-NP,I-NP,I-NP,B-PP,B-NP,I-NP,B-PP,B-NP,I-NP,O"
E:1700240650,mathematical models can have several functions,inner mongolia,3,Figure 10 Cumulative number of SARS cases in Inner Mongolia Cumulative number of SARS cases in Inner Mongolia .,"NNP,CD,JJ,NN,IN,NN,NNS,IN,NNP,NNP,JJ,NN,IN,NN,NNS,IN,NNP,NNP,.","O,NUMBER,O,O,O,O,O,O,STATE_OR_PROVINCE,STATE_OR_PROVINCE,O,O,O,O,O,O,STATE_OR_PROVINCE,STATE_OR_PROVINCE,O","B-NP,I-NP,I-NP,I-NP,B-PP,B-NP,I-NP,B-PP,B-NP,I-NP,I-NP,I-NP,B-PP,B-NP,I-NP,B-PP,B-NP,I-NP,O"
E:-1532248462,"Paris VI University, Dr. W.K",inner mongolia,14,"With these constraints we were able to simulate the epidemic at several places ( Hong Kong , Beijing , Inner Mongolia ) while other places failed to be represented faithfully ( for instance for the Guangdong region where the size of the epidemic - with only 2 or 3 new cases for some days - is too small when compared with the total population of over 80 millions : in this case either the data does not reflect the real situation or the differential model is not relevant for this setting ) .","IN,DT,NNS,PRP,VBD,JJ,TO,VB,DT,JJ,IN,JJ,NNS,-LRB-,NNP,NNP,,,NNP,,,NNP,NNP,-RRB-,IN,JJ,NNS,VBD,TO,VB,VBN,RB,-LRB-,IN,NN,IN,DT,NNP,NN,WRB,DT,NN,IN,DT,JJ,:,IN,RB,CD,CC,CD,JJ,NNS,IN,DT,NNS,:,VBZ,RB,JJ,WRB,VBN,IN,DT,JJ,NN,IN,IN,CD,NNS,:,IN,DT,NN,CC,DT,NNS,VBZ,RB,VB,DT,JJ,NN,CC,DT,JJ,NN,VBZ,RB,JJ,IN,DT,VBG,-RRB-,.","O,O,O,O,O,O,O,O,O,O,O,O,O,O,CITY,CITY,O,CITY,O,STATE_OR_PROVINCE,STATE_OR_PROVINCE,O,O,O,O,O,O,O,O,O,O,O,O,O,O,STATE_OR_PROVINCE,O,O,O,O,O,O,O,O,O,O,NUMBER,O,NUMBER,O,O,O,O,DURATION,O,O,O,O,O,O,O,O,O,O,O,O,NUMBER,NUMBER,O,O,O,O,O,O,O,O,O,O,O,O,O,O,O,O,TITLE,O,O,O,O,O,O,O,O","B-PP,B-NP,I-NP,B-NP,B-VP,B-ADJP,B-VP,I-VP,B-NP,I-NP,B-PP,B-NP,I-NP,B-VP,B-NP,I-NP,O,B-NP,O,B-NP,I-NP,I-NP,B-SBAR,B-NP,I-NP,B-VP,I-VP,I-VP,I-VP,B-NP,I-NP,B-PP,B-NP,B-PP,B-NP,I-NP,I-NP,B-ADVP,B-NP,I-NP,B-PP,B-NP,I-NP,O,B-PP,B-NP,I-NP,I-NP,I-NP,I-NP,I-NP,B-PP,B-NP,I-NP,O,B-VP,B-NP,I-NP,B-ADVP,B-PP,B-PP,B-NP,I-NP,I-NP,B-PP,B-NP,I-NP,I-NP,O,B-PP,B-NP,I-NP,O,B-NP,I-NP,B-VP,I-VP,I-VP,B-NP,I-NP,I-NP,O,B-NP,I-NP,I-NP,B-VP,O,B-ADJP,B-SBAR,B-NP,B-VP,B-NP,O"
E:-1964973935,aP = 0.272,inner mongolia,1,The statistics on the numbers of SARS cases in Inner Mongolia are obtained from http://www.moh.gov.cn/zhgl/ yqfb / index.htm .,"DT,NNS,IN,DT,NNS,IN,NN,NNS,IN,NNP,NNP,VBP,VBN,IN,NN,NN,:,NN,.","O,O,O,O,O,O,O,O,O,STATE_OR_PROVINCE,STATE_OR_PROVINCE,O,O,O,URL,O,O,O,O","B-NP,I-NP,B-PP,B-NP,I-NP,B-PP,B-NP,I-NP,B-PP,B-NP,I-NP,B-VP,I-VP,B-PP,B-NP,I-NP,I-NP,I-NP,O"
E:-844925172,E(0) = 2,inner mongolia,1,The statistics on the numbers of SARS cases in Inner Mongolia are obtained from http://www.moh.gov.cn/zhgl/ yqfb / index.htm .,"DT,NNS,IN,DT,NNS,IN,NN,NNS,IN,NNP,NNP,VBP,VBN,IN,NN,NN,:,NN,.","O,O,O,O,O,O,O,O,O,STATE_OR_PROVINCE,STATE_OR_PROVINCE,O,O,O,URL,O,O,O,O","B-NP,I-NP,B-PP,B-NP,I-NP,B-PP,B-NP,I-NP,B-PP,B-NP,I-NP,B-VP,I-VP,B-PP,B-NP,I-NP,I-NP,I-NP,O"
E:-1757616509,other parameters (including the initial conditions) were optimised to ensure a good agreement with the data and were obtained to be E(0),inner mongolia,1,The statistics on the numbers of SARS cases in Inner Mongolia are obtained from http://www.moh.gov.cn/zhgl/ yqfb / index.htm .,"DT,NNS,IN,DT,NNS,IN,NN,NNS,IN,NNP,NNP,VBP,VBN,IN,NN,NN,:,NN,.","O,O,O,O,O,O,O,O,O,STATE_OR_PROVINCE,STATE_OR_PROVINCE,O,O,O,URL,O,O,O,O","B-NP,I-NP,B-PP,B-NP,I-NP,B-PP,B-NP,I-NP,B-PP,B-NP,I-NP,B-VP,I-VP,B-PP,B-NP,I-NP,I-NP,I-NP,O"
