event_id,event,ctx,dist,sentence_text,tags,entities,chunks
E:-2099349734,set of coronavirus mediated epidemics that affected pigs,beijing,17,Figure 9 Number of SARS cases per day in Beijing Number of SARS cases per day in Beijing .,"NNP,CD,NN,IN,NN,NNS,IN,NN,IN,NNP,NN,IN,NN,NNS,IN,NN,IN,NNP,.","O,NUMBER,O,O,O,O,O,DURATION,O,CITY,O,O,O,O,O,DURATION,O,CITY,O","B-NP,I-NP,I-NP,B-PP,B-NP,I-NP,B-PP,B-NP,B-PP,B-NP,I-NP,B-PP,B-NP,I-NP,B-PP,B-NP,B-PP,B-NP,O"
E:-234630779,"It is based on the high mutation and  recombination rate of  coronaviruses [2], and on the observation",beijing,19,Figure 9 Number of SARS cases per day in Beijing Number of SARS cases per day in Beijing .,"NNP,CD,NN,IN,NN,NNS,IN,NN,IN,NNP,NN,IN,NN,NNS,IN,NN,IN,NNP,.","O,NUMBER,O,O,O,O,O,DURATION,O,CITY,O,O,O,O,O,DURATION,O,CITY,O","B-NP,I-NP,I-NP,B-PP,B-NP,I-NP,B-PP,B-NP,B-PP,B-NP,I-NP,B-PP,B-NP,I-NP,B-PP,B-NP,B-PP,B-NP,O"
E:-978116680,it would cause gastroenteritis,beijing,22,Figure 9 Number of SARS cases per day in Beijing Number of SARS cases per day in Beijing .,"NNP,CD,NN,IN,NN,NNS,IN,NN,IN,NNP,NN,IN,NN,NNS,IN,NN,IN,NNP,.","O,NUMBER,O,O,O,O,O,DURATION,O,CITY,O,O,O,O,O,DURATION,O,CITY,O","B-NP,I-NP,I-NP,B-PP,B-NP,I-NP,B-PP,B-NP,B-PP,B-NP,I-NP,B-PP,B-NP,I-NP,B-PP,B-NP,B-PP,B-NP,O"
E:133243356,"We also explore the possible situation where  viruses A and  B would be of totally different origin, but would cause an overlapping immune response of  the host",beijing,24,Figure 9 Number of SARS cases per day in Beijing Number of SARS cases per day in Beijing .,"NNP,CD,NN,IN,NN,NNS,IN,NN,IN,NNP,NN,IN,NN,NNS,IN,NN,IN,NNP,.","O,NUMBER,O,O,O,O,O,DURATION,O,CITY,O,O,O,O,O,DURATION,O,CITY,O","B-NP,I-NP,I-NP,B-PP,B-NP,I-NP,B-PP,B-NP,B-PP,B-NP,I-NP,B-PP,B-NP,I-NP,B-PP,B-NP,B-PP,B-NP,O"
E:1892020837,many possibilities based on virus behavior,beijing,3,Figure 9 Number of SARS cases per day in Beijing Number of SARS cases per day in Beijing .,"NNP,CD,NN,IN,NN,NNS,IN,NN,IN,NNP,NN,IN,NN,NNS,IN,NN,IN,NNP,.","O,NUMBER,O,O,O,O,O,DURATION,O,CITY,O,O,O,O,O,DURATION,O,CITY,O","B-NP,I-NP,I-NP,B-PP,B-NP,I-NP,B-PP,B-NP,B-PP,B-NP,I-NP,B-PP,B-NP,I-NP,B-PP,B-NP,B-PP,B-NP,O"
E:527339462,"SARS [14], a coronavirus",beijing,6,Figure 9 Number of SARS cases per day in Beijing Number of SARS cases per day in Beijing .,"NNP,CD,NN,IN,NN,NNS,IN,NN,IN,NNP,NN,IN,NN,NNS,IN,NN,IN,NNP,.","O,NUMBER,O,O,O,O,O,DURATION,O,CITY,O,O,O,O,O,DURATION,O,CITY,O","B-NP,I-NP,I-NP,B-PP,B-NP,I-NP,B-PP,B-NP,B-PP,B-NP,I-NP,B-PP,B-NP,I-NP,B-PP,B-NP,B-PP,B-NP,O"
E:1600242282,virus and its variant caused a double epidemic,beijing,6,Figure 9 Number of SARS cases per day in Beijing Number of SARS cases per day in Beijing .,"NNP,CD,NN,IN,NN,NNS,IN,NN,IN,NNP,NN,IN,NN,NNS,IN,NN,IN,NNP,.","O,NUMBER,O,O,O,O,O,DURATION,O,CITY,O,O,O,O,O,DURATION,O,CITY,O","B-NP,I-NP,I-NP,B-PP,B-NP,I-NP,B-PP,B-NP,B-PP,B-NP,I-NP,B-PP,B-NP,I-NP,B-PP,B-NP,B-PP,B-NP,O"
E:-1787604617,nature of the virus that causes SARS,beijing,6,Figure 9 Number of SARS cases per day in Beijing Number of SARS cases per day in Beijing .,"NNP,CD,NN,IN,NN,NNS,IN,NN,IN,NNP,NN,IN,NN,NNS,IN,NN,IN,NNP,.","O,NUMBER,O,O,O,O,O,DURATION,O,CITY,O,O,O,O,O,DURATION,O,CITY,O","B-NP,I-NP,I-NP,B-PP,B-NP,I-NP,B-PP,B-NP,B-PP,B-NP,I-NP,B-PP,B-NP,I-NP,B-PP,B-NP,B-PP,B-NP,O"
E:568001232,the so called Susceptible-Infected-Removed (SIR) model which is simple and useful when one tries to understand the propagation of many real-life epidemics,beijing,10,"BMC Infectious Diseases 2003 , 3 country , and with people who are highly connected both in terms of travelling and communication , and in genetic background , between the number of cases , as illustrated by the difference between the number of SARS cases in Beijing ( in thousands ) and in Shanghai ( in tens at most ) .","NNP,JJ,NNS,CD,,,CD,NN,,,CC,IN,NNS,WP,VBP,RB,VBN,CC,IN,NNS,IN,VBG,CC,NN,,,CC,IN,JJ,NN,,,IN,DT,NN,IN,NNS,,,IN,VBN,IN,DT,NN,IN,DT,NN,IN,NN,NNS,IN,NNP,-LRB-,IN,NNS,-RRB-,CC,IN,NNP,-LRB-,IN,NNS,IN,JJS,-RRB-,.","O,O,CAUSE_OF_DEATH,DATE,O,NUMBER,O,O,O,O,O,O,O,O,O,O,O,O,O,O,O,O,O,O,O,O,O,O,O,O,O,O,O,O,O,O,O,O,O,O,O,O,O,O,O,O,CITY,O,O,O,O,O,O,CITY,O,O,O,O,O,O,O","B-NP,I-NP,I-NP,I-NP,I-NP,I-NP,I-NP,O,O,B-PP,B-NP,B-NP,B-VP,I-VP,I-VP,O,B-PP,B-NP,B-PP,B-NP,I-NP,I-NP,O,O,B-PP,B-NP,I-NP,O,B-PP,B-NP,I-NP,B-PP,B-NP,O,B-SBAR,B-VP,B-PP,B-NP,I-NP,B-PP,B-NP,I-NP,B-PP,B-NP,I-NP,B-PP,B-NP,I-NP,B-PP,B-NP,I-NP,B-PP,B-PP,B-NP,I-NP,B-PP,B-NP,B-PP,B-NP,I-NP,O"
E:1700240650,mathematical models can have several functions,beijing,41,"Various consequences of the spreading pattern of this double epidemic hypothesis are discussed in relation with the puzzling distribution of the disease in Mainland China , noticeably , in the huge difference witnessed between the situation in Beijing and in Shanghai ( both regions have tight and frequent contacts with Guangdong and Hong Kong ) .","JJ,NNS,IN,DT,NN,NN,IN,DT,JJ,JJ,NN,VBP,VBN,IN,NN,IN,DT,JJ,NN,IN,DT,NN,IN,NNP,NNP,,,RB,,,IN,DT,JJ,NN,VBD,IN,DT,NN,IN,NNP,CC,IN,NNP,-LRB-,CC,NNS,VBP,JJ,CC,JJ,NNS,IN,NNP,CC,NNP,NNP,-RRB-,.","O,O,O,O,O,O,O,O,O,O,O,O,O,O,O,O,O,O,O,O,O,CAUSE_OF_DEATH,O,LOCATION,COUNTRY,O,O,O,O,O,O,O,O,O,O,O,O,CITY,O,O,CITY,O,O,O,O,O,O,O,O,O,STATE_OR_PROVINCE,O,CITY,CITY,O,O","B-NP,I-NP,B-PP,B-NP,I-NP,I-NP,B-PP,B-NP,I-NP,I-NP,I-NP,B-VP,I-VP,B-PP,B-NP,B-PP,B-NP,I-NP,I-NP,B-PP,B-NP,I-NP,B-PP,B-NP,I-NP,O,B-ADVP,O,B-PP,B-NP,I-NP,I-NP,B-VP,B-PP,B-NP,I-NP,B-PP,B-NP,B-PP,B-PP,B-NP,I-NP,I-NP,I-NP,B-VP,B-NP,I-NP,I-NP,I-NP,B-PP,B-NP,O,O,O,O,O"
E:-1532248462,"Paris VI University, Dr. W.K",beijing,14,"With these constraints we were able to simulate the epidemic at several places ( Hong Kong , Beijing , Inner Mongolia ) while other places failed to be represented faithfully ( for instance for the Guangdong region where the size of the epidemic - with only 2 or 3 new cases for some days - is too small when compared with the total population of over 80 millions : in this case either the data does not reflect the real situation or the differential model is not relevant for this setting ) .","IN,DT,NNS,PRP,VBD,JJ,TO,VB,DT,JJ,IN,JJ,NNS,-LRB-,NNP,NNP,,,NNP,,,NNP,NNP,-RRB-,IN,JJ,NNS,VBD,TO,VB,VBN,RB,-LRB-,IN,NN,IN,DT,NNP,NN,WRB,DT,NN,IN,DT,JJ,:,IN,RB,CD,CC,CD,JJ,NNS,IN,DT,NNS,:,VBZ,RB,JJ,WRB,VBN,IN,DT,JJ,NN,IN,IN,CD,NNS,:,IN,DT,NN,CC,DT,NNS,VBZ,RB,VB,DT,JJ,NN,CC,DT,JJ,NN,VBZ,RB,JJ,IN,DT,VBG,-RRB-,.","O,O,O,O,O,O,O,O,O,O,O,O,O,O,CITY,CITY,O,CITY,O,STATE_OR_PROVINCE,STATE_OR_PROVINCE,O,O,O,O,O,O,O,O,O,O,O,O,O,O,STATE_OR_PROVINCE,O,O,O,O,O,O,O,O,O,O,NUMBER,O,NUMBER,O,O,O,O,DURATION,O,O,O,O,O,O,O,O,O,O,O,O,NUMBER,NUMBER,O,O,O,O,O,O,O,O,O,O,O,O,O,O,O,O,TITLE,O,O,O,O,O,O,O,O","B-PP,B-NP,I-NP,B-NP,B-VP,B-ADJP,B-VP,I-VP,B-NP,I-NP,B-PP,B-NP,I-NP,B-VP,B-NP,I-NP,O,B-NP,O,B-NP,I-NP,I-NP,B-SBAR,B-NP,I-NP,B-VP,I-VP,I-VP,I-VP,B-NP,I-NP,B-PP,B-NP,B-PP,B-NP,I-NP,I-NP,B-ADVP,B-NP,I-NP,B-PP,B-NP,I-NP,O,B-PP,B-NP,I-NP,I-NP,I-NP,I-NP,I-NP,B-PP,B-NP,I-NP,O,B-VP,B-NP,I-NP,B-ADVP,B-PP,B-PP,B-NP,I-NP,I-NP,B-PP,B-NP,I-NP,I-NP,O,B-PP,B-NP,I-NP,O,B-NP,I-NP,B-VP,I-VP,I-VP,B-NP,I-NP,I-NP,O,B-NP,I-NP,I-NP,B-VP,O,B-ADJP,B-SBAR,B-NP,B-VP,B-NP,O"
E:-708689561,Our model would then be useful to enforce proper precautionary measures immediately,beijing,24,"With these constraints we were able to simulate the epidemic at several places ( Hong Kong , Beijing , Inner Mongolia ) while other places failed to be represented faithfully ( for instance for the Guangdong region where the size of the epidemic - with only 2 or 3 new cases for some days - is too small when compared with the total population of over 80 millions : in this case either the data does not reflect the real situation or the differential model is not relevant for this setting ) .","IN,DT,NNS,PRP,VBD,JJ,TO,VB,DT,JJ,IN,JJ,NNS,-LRB-,NNP,NNP,,,NNP,,,NNP,NNP,-RRB-,IN,JJ,NNS,VBD,TO,VB,VBN,RB,-LRB-,IN,NN,IN,DT,NNP,NN,WRB,DT,NN,IN,DT,JJ,:,IN,RB,CD,CC,CD,JJ,NNS,IN,DT,NNS,:,VBZ,RB,JJ,WRB,VBN,IN,DT,JJ,NN,IN,IN,CD,NNS,:,IN,DT,NN,CC,DT,NNS,VBZ,RB,VB,DT,JJ,NN,CC,DT,JJ,NN,VBZ,RB,JJ,IN,DT,VBG,-RRB-,.","O,O,O,O,O,O,O,O,O,O,O,O,O,O,CITY,CITY,O,CITY,O,STATE_OR_PROVINCE,STATE_OR_PROVINCE,O,O,O,O,O,O,O,O,O,O,O,O,O,O,STATE_OR_PROVINCE,O,O,O,O,O,O,O,O,O,O,NUMBER,O,NUMBER,O,O,O,O,DURATION,O,O,O,O,O,O,O,O,O,O,O,O,NUMBER,NUMBER,O,O,O,O,O,O,O,O,O,O,O,O,O,O,O,O,TITLE,O,O,O,O,O,O,O,O","B-PP,B-NP,I-NP,B-NP,B-VP,B-ADJP,B-VP,I-VP,B-NP,I-NP,B-PP,B-NP,I-NP,B-VP,B-NP,I-NP,O,B-NP,O,B-NP,I-NP,I-NP,B-SBAR,B-NP,I-NP,B-VP,I-VP,I-VP,I-VP,B-NP,I-NP,B-PP,B-NP,B-PP,B-NP,I-NP,I-NP,B-ADVP,B-NP,I-NP,B-PP,B-NP,I-NP,O,B-PP,B-NP,I-NP,I-NP,I-NP,I-NP,I-NP,B-PP,B-NP,I-NP,O,B-VP,B-NP,I-NP,B-ADVP,B-PP,B-PP,B-NP,I-NP,I-NP,B-PP,B-NP,I-NP,I-NP,O,B-PP,B-NP,I-NP,O,B-NP,I-NP,B-VP,I-VP,I-VP,B-NP,I-NP,I-NP,O,B-NP,I-NP,I-NP,B-VP,O,B-ADJP,B-SBAR,B-NP,B-VP,B-NP,O"
E:861706502,applied the SEIRP model to study the outbreak of SARS in Beijing,beijing,0,Case study : the Outbreak of SARS in Beijing We have also applied the SEIRP model to study the outbreak of SARS in Beijing .,"NNP,NN,:,DT,NN,IN,NNP,IN,NNP,PRP,VBP,RB,VBN,DT,NN,NN,TO,VB,DT,NN,IN,NNP,IN,NNP,.","O,O,O,O,O,O,O,O,CITY,O,O,O,O,O,O,TITLE,O,O,O,O,O,O,O,CITY,O","B-NP,I-NP,O,B-NP,I-NP,B-PP,B-NP,B-PP,B-NP,B-NP,B-VP,I-VP,I-VP,B-NP,I-NP,I-NP,B-VP,I-VP,B-NP,I-NP,B-PP,B-NP,B-PP,B-NP,O"
E:-724343143,b = 0.103,beijing,1,The statistics on the numbers of SARS cases in Beijing are obtained from http :// www.moh.gov.cn/zhgl/yqfb/index.htm .,"DT,NNS,IN,DT,NNS,IN,NN,NNS,IN,NNP,VBP,VBN,IN,JJ,CD,NN,.","O,O,O,O,O,O,O,O,O,CITY,O,O,O,O,NUMBER,URL,O","B-NP,I-NP,B-PP,B-NP,I-NP,B-PP,B-NP,I-NP,B-PP,B-NP,B-VP,I-VP,B-PP,B-NP,I-NP,I-NP,O"
E:1085138570,IP(0) = 35000,beijing,1,The statistics on the numbers of SARS cases in Beijing are obtained from http :// www.moh.gov.cn/zhgl/yqfb/index.htm .,"DT,NNS,IN,DT,NNS,IN,NN,NNS,IN,NNP,VBP,VBN,IN,JJ,CD,NN,.","O,O,O,O,O,O,O,O,O,CITY,O,O,O,O,NUMBER,URL,O","B-NP,I-NP,B-PP,B-NP,I-NP,B-PP,B-NP,I-NP,B-PP,B-NP,B-VP,I-VP,B-PP,B-NP,I-NP,I-NP,O"
E:-1577488090,initial population S(0) was set to be 13.82 millions,beijing,1,The statistics on the numbers of SARS cases in Beijing are obtained from http :// www.moh.gov.cn/zhgl/yqfb/index.htm .,"DT,NNS,IN,DT,NNS,IN,NN,NNS,IN,NNP,VBP,VBN,IN,JJ,CD,NN,.","O,O,O,O,O,O,O,O,O,CITY,O,O,O,O,NUMBER,URL,O","B-NP,I-NP,B-PP,B-NP,I-NP,B-PP,B-NP,I-NP,B-PP,B-NP,B-VP,I-VP,B-PP,B-NP,I-NP,I-NP,O"
E:-269422342,E(0) = 400,beijing,1,The statistics on the numbers of SARS cases in Beijing are obtained from http :// www.moh.gov.cn/zhgl/yqfb/index.htm .,"DT,NNS,IN,DT,NNS,IN,NN,NNS,IN,NNP,VBP,VBN,IN,JJ,CD,NN,.","O,O,O,O,O,O,O,O,O,CITY,O,O,O,O,NUMBER,URL,O","B-NP,I-NP,B-PP,B-NP,I-NP,B-PP,B-NP,I-NP,B-PP,B-NP,B-VP,I-VP,B-PP,B-NP,I-NP,I-NP,O"
E:-732426276,I(0) = 340,beijing,1,The statistics on the numbers of SARS cases in Beijing are obtained from http :// www.moh.gov.cn/zhgl/yqfb/index.htm .,"DT,NNS,IN,DT,NNS,IN,NN,NNS,IN,NNP,VBP,VBN,IN,JJ,CD,NN,.","O,O,O,O,O,O,O,O,O,CITY,O,O,O,O,NUMBER,URL,O","B-NP,I-NP,B-PP,B-NP,I-NP,B-PP,B-NP,I-NP,B-PP,B-NP,B-VP,I-VP,B-PP,B-NP,I-NP,I-NP,O"
E:1140788243,aP = 0.618,beijing,1,The statistics on the numbers of SARS cases in Beijing are obtained from http :// www.moh.gov.cn/zhgl/yqfb/index.htm .,"DT,NNS,IN,DT,NNS,IN,NN,NNS,IN,NNP,VBP,VBN,IN,JJ,CD,NN,.","O,O,O,O,O,O,O,O,O,CITY,O,O,O,O,NUMBER,URL,O","B-NP,I-NP,B-PP,B-NP,I-NP,B-PP,B-NP,I-NP,B-PP,B-NP,B-VP,I-VP,B-PP,B-NP,I-NP,I-NP,O"
E:-1581552844,rP = 10.79 x 10-8,beijing,1,The statistics on the numbers of SARS cases in Beijing are obtained from http :// www.moh.gov.cn/zhgl/yqfb/index.htm .,"DT,NNS,IN,DT,NNS,IN,NN,NNS,IN,NNP,VBP,VBN,IN,JJ,CD,NN,.","O,O,O,O,O,O,O,O,O,CITY,O,O,O,O,NUMBER,URL,O","B-NP,I-NP,B-PP,B-NP,I-NP,B-PP,B-NP,I-NP,B-PP,B-NP,B-VP,I-VP,B-PP,B-NP,I-NP,I-NP,O"
E:1582406032,R(0) = 0,beijing,1,The statistics on the numbers of SARS cases in Beijing are obtained from http :// www.moh.gov.cn/zhgl/yqfb/index.htm .,"DT,NNS,IN,DT,NNS,IN,NN,NNS,IN,NNP,VBP,VBN,IN,JJ,CD,NN,.","O,O,O,O,O,O,O,O,O,CITY,O,O,O,O,NUMBER,URL,O","B-NP,I-NP,B-PP,B-NP,I-NP,B-PP,B-NP,I-NP,B-PP,B-NP,B-VP,I-VP,B-PP,B-NP,I-NP,I-NP,O"
E:1330787582,a = 0.488,beijing,1,The statistics on the numbers of SARS cases in Beijing are obtained from http :// www.moh.gov.cn/zhgl/yqfb/index.htm .,"DT,NNS,IN,DT,NNS,IN,NN,NNS,IN,NNP,VBP,VBN,IN,JJ,CD,NN,.","O,O,O,O,O,O,O,O,O,CITY,O,O,O,O,NUMBER,URL,O","B-NP,I-NP,B-PP,B-NP,I-NP,B-PP,B-NP,I-NP,B-PP,B-NP,B-VP,I-VP,B-PP,B-NP,I-NP,I-NP,O"
E:-421663532,r = 7.69 x 10-8,beijing,1,The statistics on the numbers of SARS cases in Beijing are obtained from http :// www.moh.gov.cn/zhgl/yqfb/index.htm .,"DT,NNS,IN,DT,NNS,IN,NN,NNS,IN,NNP,VBP,VBN,IN,JJ,CD,NN,.","O,O,O,O,O,O,O,O,O,CITY,O,O,O,O,NUMBER,URL,O","B-NP,I-NP,B-PP,B-NP,I-NP,B-PP,B-NP,I-NP,B-PP,B-NP,B-VP,I-VP,B-PP,B-NP,I-NP,I-NP,O"
E:71584185,RP(0) = 0,beijing,1,The statistics on the numbers of SARS cases in Beijing are obtained from http :// www.moh.gov.cn/zhgl/yqfb/index.htm .,"DT,NNS,IN,DT,NNS,IN,NN,NNS,IN,NNP,VBP,VBN,IN,JJ,CD,NN,.","O,O,O,O,O,O,O,O,O,CITY,O,O,O,O,NUMBER,URL,O","B-NP,I-NP,B-PP,B-NP,I-NP,B-PP,B-NP,I-NP,B-PP,B-NP,B-VP,I-VP,B-PP,B-NP,I-NP,I-NP,O"
E:1442295099,RP = 12 millions,beijing,3,The statistics on the numbers of SARS cases in Beijing are obtained from http :// www.moh.gov.cn/zhgl/yqfb/index.htm .,"DT,NNS,IN,DT,NNS,IN,NN,NNS,IN,NNP,VBP,VBN,IN,JJ,CD,NN,.","O,O,O,O,O,O,O,O,O,CITY,O,O,O,O,NUMBER,URL,O","B-NP,I-NP,B-PP,B-NP,I-NP,B-PP,B-NP,I-NP,B-PP,B-NP,B-VP,I-VP,B-PP,B-NP,I-NP,I-NP,O"
E:-1763550326,RP = 12 millions,beijing,3,The statistics on the numbers of SARS cases in Beijing are obtained from http :// www.moh.gov.cn/zhgl/yqfb/index.htm .,"DT,NNS,IN,DT,NNS,IN,NN,NNS,IN,NNP,VBP,VBN,IN,JJ,CD,NN,.","O,O,O,O,O,O,O,O,O,CITY,O,O,O,O,NUMBER,URL,O","B-NP,I-NP,B-PP,B-NP,I-NP,B-PP,B-NP,I-NP,B-PP,B-NP,B-VP,I-VP,B-PP,B-NP,I-NP,I-NP,O"
E:-1971213694,total number of people infected with the protective virus is RP = 12 millions,beijing,3,The statistics on the numbers of SARS cases in Beijing are obtained from http :// www.moh.gov.cn/zhgl/yqfb/index.htm .,"DT,NNS,IN,DT,NNS,IN,NN,NNS,IN,NNP,VBP,VBN,IN,JJ,CD,NN,.","O,O,O,O,O,O,O,O,O,CITY,O,O,O,O,NUMBER,URL,O","B-NP,I-NP,B-PP,B-NP,I-NP,B-PP,B-NP,I-NP,B-PP,B-NP,B-VP,I-VP,B-PP,B-NP,I-NP,I-NP,O"
E:1654336587,RP = 12 millions,beijing,3,The statistics on the numbers of SARS cases in Beijing are obtained from http :// www.moh.gov.cn/zhgl/yqfb/index.htm .,"DT,NNS,IN,DT,NNS,IN,NN,NNS,IN,NNP,VBP,VBN,IN,JJ,CD,NN,.","O,O,O,O,O,O,O,O,O,CITY,O,O,O,O,NUMBER,URL,O","B-NP,I-NP,B-PP,B-NP,I-NP,B-PP,B-NP,I-NP,B-PP,B-NP,B-VP,I-VP,B-PP,B-NP,I-NP,I-NP,O"
E:-2144929051,simulation results in a final value of  the total people infected with the SARS virus,beijing,4,The statistics on the numbers of SARS cases in Beijing are obtained from http :// www.moh.gov.cn/zhgl/yqfb/index.htm .,"DT,NNS,IN,DT,NNS,IN,NN,NNS,IN,NNP,VBP,VBN,IN,JJ,CD,NN,.","O,O,O,O,O,O,O,O,O,CITY,O,O,O,O,NUMBER,URL,O","B-NP,I-NP,B-PP,B-NP,I-NP,B-PP,B-NP,I-NP,B-PP,B-NP,B-VP,I-VP,B-PP,B-NP,I-NP,I-NP,O"
E:1142341819,SIR model cannot represent the unfolding of the SARS epidemic,beijing,101,"Various consequences of the spreading pattern of this double epidemic hypothesis are discussed in relation with the puzzling distribution of the disease in Mainland China , noticeably , in the huge difference witnessed between the situation in Beijing and in Shanghai ( both regions have tight and frequent contacts with Guangdong and Hong Kong ) .","JJ,NNS,IN,DT,NN,NN,IN,DT,JJ,JJ,NN,VBP,VBN,IN,NN,IN,DT,JJ,NN,IN,DT,NN,IN,NNP,NNP,,,RB,,,IN,DT,JJ,NN,VBD,IN,DT,NN,IN,NNP,CC,IN,NNP,-LRB-,CC,NNS,VBP,JJ,CC,JJ,NNS,IN,NNP,CC,NNP,NNP,-RRB-,.","O,O,O,O,O,O,O,O,O,O,O,O,O,O,O,O,O,O,O,O,O,CAUSE_OF_DEATH,O,LOCATION,COUNTRY,O,O,O,O,O,O,O,O,O,O,O,O,CITY,O,O,CITY,O,O,O,O,O,O,O,O,O,STATE_OR_PROVINCE,O,CITY,CITY,O,O","B-NP,I-NP,B-PP,B-NP,I-NP,I-NP,B-PP,B-NP,I-NP,I-NP,I-NP,B-VP,I-VP,B-PP,B-NP,B-PP,B-NP,I-NP,I-NP,B-PP,B-NP,I-NP,B-PP,B-NP,I-NP,O,B-ADVP,O,B-PP,B-NP,I-NP,I-NP,B-VP,B-PP,B-NP,I-NP,B-PP,B-NP,B-PP,B-PP,B-NP,I-NP,I-NP,I-NP,B-VP,B-NP,I-NP,I-NP,I-NP,B-PP,B-NP,O,O,O,O,O"
E:1431006785,the simple model of contagion by a single stable virus does not hold,beijing,102,"Various consequences of the spreading pattern of this double epidemic hypothesis are discussed in relation with the puzzling distribution of the disease in Mainland China , noticeably , in the huge difference witnessed between the situation in Beijing and in Shanghai ( both regions have tight and frequent contacts with Guangdong and Hong Kong ) .","JJ,NNS,IN,DT,NN,NN,IN,DT,JJ,JJ,NN,VBP,VBN,IN,NN,IN,DT,JJ,NN,IN,DT,NN,IN,NNP,NNP,,,RB,,,IN,DT,JJ,NN,VBD,IN,DT,NN,IN,NNP,CC,IN,NNP,-LRB-,CC,NNS,VBP,JJ,CC,JJ,NNS,IN,NNP,CC,NNP,NNP,-RRB-,.","O,O,O,O,O,O,O,O,O,O,O,O,O,O,O,O,O,O,O,O,O,CAUSE_OF_DEATH,O,LOCATION,COUNTRY,O,O,O,O,O,O,O,O,O,O,O,O,CITY,O,O,CITY,O,O,O,O,O,O,O,O,O,STATE_OR_PROVINCE,O,CITY,CITY,O,O","B-NP,I-NP,B-PP,B-NP,I-NP,I-NP,B-PP,B-NP,I-NP,I-NP,I-NP,B-VP,I-VP,B-PP,B-NP,B-PP,B-NP,I-NP,I-NP,B-PP,B-NP,I-NP,B-PP,B-NP,I-NP,O,B-ADVP,O,B-PP,B-NP,I-NP,I-NP,B-VP,B-PP,B-NP,I-NP,B-PP,B-NP,B-PP,B-PP,B-NP,I-NP,I-NP,I-NP,B-VP,B-NP,I-NP,I-NP,I-NP,B-PP,B-NP,O,O,O,O,O"
E:-662418356,data may be inaccurate to account for the reality of the epidemic,beijing,103,"Various consequences of the spreading pattern of this double epidemic hypothesis are discussed in relation with the puzzling distribution of the disease in Mainland China , noticeably , in the huge difference witnessed between the situation in Beijing and in Shanghai ( both regions have tight and frequent contacts with Guangdong and Hong Kong ) .","JJ,NNS,IN,DT,NN,NN,IN,DT,JJ,JJ,NN,VBP,VBN,IN,NN,IN,DT,JJ,NN,IN,DT,NN,IN,NNP,NNP,,,RB,,,IN,DT,JJ,NN,VBD,IN,DT,NN,IN,NNP,CC,IN,NNP,-LRB-,CC,NNS,VBP,JJ,CC,JJ,NNS,IN,NNP,CC,NNP,NNP,-RRB-,.","O,O,O,O,O,O,O,O,O,O,O,O,O,O,O,O,O,O,O,O,O,CAUSE_OF_DEATH,O,LOCATION,COUNTRY,O,O,O,O,O,O,O,O,O,O,O,O,CITY,O,O,CITY,O,O,O,O,O,O,O,O,O,STATE_OR_PROVINCE,O,CITY,CITY,O,O","B-NP,I-NP,B-PP,B-NP,I-NP,I-NP,B-PP,B-NP,I-NP,I-NP,I-NP,B-VP,I-VP,B-PP,B-NP,B-PP,B-NP,I-NP,I-NP,B-PP,B-NP,I-NP,B-PP,B-NP,I-NP,O,B-ADVP,O,B-PP,B-NP,I-NP,I-NP,B-VP,B-PP,B-NP,I-NP,B-PP,B-NP,B-PP,B-PP,B-NP,I-NP,I-NP,I-NP,B-VP,B-NP,I-NP,I-NP,I-NP,B-PP,B-NP,O,O,O,O,O"
E:-588333412,r and rP are related to the infective rates,beijing,5,"For instance , the lifestyles of the people in Beijing and Inner Mongolia are very different because Beijing is the capital , and hence much richer ( with better hygiene , but with more important air pollution ) .","IN,NN,,,DT,NNS,IN,DT,NNS,IN,NNP,CC,NNP,NNP,VBP,RB,JJ,IN,NNP,VBZ,DT,NN,,,CC,RB,JJ,JJR,-LRB-,IN,JJR,NN,,,CC,IN,RBR,JJ,NN,NN,-RRB-,.","O,O,O,O,O,O,O,O,O,CITY,O,STATE_OR_PROVINCE,STATE_OR_PROVINCE,O,O,O,O,CITY,O,O,O,O,O,O,O,O,O,O,O,O,O,O,O,O,O,O,O,O,O","B-PP,B-NP,O,B-NP,I-NP,B-PP,B-NP,I-NP,B-PP,B-NP,I-NP,I-NP,I-NP,B-VP,B-ADJP,I-ADJP,B-SBAR,B-NP,B-VP,B-NP,I-NP,O,O,B-NP,I-NP,I-NP,I-NP,B-PP,B-NP,I-NP,O,O,B-PP,B-NP,I-NP,I-NP,I-NP,I-NP,O"
E:1868582194,rP are related to the infective rates,beijing,5,"For instance , the lifestyles of the people in Beijing and Inner Mongolia are very different because Beijing is the capital , and hence much richer ( with better hygiene , but with more important air pollution ) .","IN,NN,,,DT,NNS,IN,DT,NNS,IN,NNP,CC,NNP,NNP,VBP,RB,JJ,IN,NNP,VBZ,DT,NN,,,CC,RB,JJ,JJR,-LRB-,IN,JJR,NN,,,CC,IN,RBR,JJ,NN,NN,-RRB-,.","O,O,O,O,O,O,O,O,O,CITY,O,STATE_OR_PROVINCE,STATE_OR_PROVINCE,O,O,O,O,CITY,O,O,O,O,O,O,O,O,O,O,O,O,O,O,O,O,O,O,O,O,O","B-PP,B-NP,O,B-NP,I-NP,B-PP,B-NP,I-NP,B-PP,B-NP,I-NP,I-NP,I-NP,B-VP,B-ADJP,I-ADJP,B-SBAR,B-NP,B-VP,B-NP,I-NP,O,O,B-NP,I-NP,I-NP,I-NP,B-PP,B-NP,I-NP,O,O,B-PP,B-NP,I-NP,I-NP,I-NP,I-NP,O"
E:381749299,parameters r and rP are related to the infective rates,beijing,5,"For instance , the lifestyles of the people in Beijing and Inner Mongolia are very different because Beijing is the capital , and hence much richer ( with better hygiene , but with more important air pollution ) .","IN,NN,,,DT,NNS,IN,DT,NNS,IN,NNP,CC,NNP,NNP,VBP,RB,JJ,IN,NNP,VBZ,DT,NN,,,CC,RB,JJ,JJR,-LRB-,IN,JJR,NN,,,CC,IN,RBR,JJ,NN,NN,-RRB-,.","O,O,O,O,O,O,O,O,O,CITY,O,STATE_OR_PROVINCE,STATE_OR_PROVINCE,O,O,O,O,CITY,O,O,O,O,O,O,O,O,O,O,O,O,O,O,O,O,O,O,O,O,O","B-PP,B-NP,O,B-NP,I-NP,B-PP,B-NP,I-NP,B-PP,B-NP,I-NP,I-NP,I-NP,B-VP,B-ADJP,I-ADJP,B-SBAR,B-NP,B-VP,B-NP,I-NP,O,O,B-NP,I-NP,I-NP,I-NP,B-PP,B-NP,I-NP,O,O,B-PP,B-NP,I-NP,I-NP,I-NP,I-NP,O"
E:1450684030,rP are related to the infective rates,beijing,5,"For instance , the lifestyles of the people in Beijing and Inner Mongolia are very different because Beijing is the capital , and hence much richer ( with better hygiene , but with more important air pollution ) .","IN,NN,,,DT,NNS,IN,DT,NNS,IN,NNP,CC,NNP,NNP,VBP,RB,JJ,IN,NNP,VBZ,DT,NN,,,CC,RB,JJ,JJR,-LRB-,IN,JJR,NN,,,CC,IN,RBR,JJ,NN,NN,-RRB-,.","O,O,O,O,O,O,O,O,O,CITY,O,STATE_OR_PROVINCE,STATE_OR_PROVINCE,O,O,O,O,CITY,O,O,O,O,O,O,O,O,O,O,O,O,O,O,O,O,O,O,O,O,O","B-PP,B-NP,O,B-NP,I-NP,B-PP,B-NP,I-NP,B-PP,B-NP,I-NP,I-NP,I-NP,B-VP,B-ADJP,I-ADJP,B-SBAR,B-NP,B-VP,B-NP,I-NP,O,O,B-NP,I-NP,I-NP,I-NP,B-PP,B-NP,I-NP,O,O,B-PP,B-NP,I-NP,I-NP,I-NP,I-NP,O"
E:-2113527440,infective rates that may depend on the hygienic situation,beijing,5,"For instance , the lifestyles of the people in Beijing and Inner Mongolia are very different because Beijing is the capital , and hence much richer ( with better hygiene , but with more important air pollution ) .","IN,NN,,,DT,NNS,IN,DT,NNS,IN,NNP,CC,NNP,NNP,VBP,RB,JJ,IN,NNP,VBZ,DT,NN,,,CC,RB,JJ,JJR,-LRB-,IN,JJR,NN,,,CC,IN,RBR,JJ,NN,NN,-RRB-,.","O,O,O,O,O,O,O,O,O,CITY,O,STATE_OR_PROVINCE,STATE_OR_PROVINCE,O,O,O,O,CITY,O,O,O,O,O,O,O,O,O,O,O,O,O,O,O,O,O,O,O,O,O","B-PP,B-NP,O,B-NP,I-NP,B-PP,B-NP,I-NP,B-PP,B-NP,I-NP,I-NP,I-NP,B-VP,B-ADJP,I-ADJP,B-SBAR,B-NP,B-VP,B-NP,I-NP,O,O,B-NP,I-NP,I-NP,I-NP,B-PP,B-NP,I-NP,O,O,B-PP,B-NP,I-NP,I-NP,I-NP,I-NP,O"
E:-1543473600,the model does not hold (indicating,beijing,10,"In particular , the b value for Inner Mongolia is 76 times that of Beijing , implying that latency lasts so much longer in Beijing .","IN,JJ,,,DT,NN,NN,IN,NNP,NNP,VBZ,CD,NNS,IN,IN,NNP,,,VBG,IN,NN,VBZ,RB,RB,RBR,IN,NNP,.","O,O,O,O,O,O,O,STATE_OR_PROVINCE,STATE_OR_PROVINCE,O,NUMBER,O,O,O,CITY,O,O,O,O,O,O,O,O,O,CITY,O","B-PP,B-NP,O,B-NP,I-NP,I-NP,B-PP,B-NP,I-NP,B-VP,B-NP,I-NP,I-NP,B-PP,B-NP,O,B-VP,B-SBAR,B-NP,B-VP,B-ADVP,I-ADVP,I-ADVP,B-PP,B-NP,O"
E:-909761626,r is the infection rate,beijing,2,"Note that in Hong Kong , r > rP but this relation is reversed in Beijing and Inner Mongolia .","VB,IN,IN,NNP,NNP,,,NN,JJR,NN,CC,DT,NN,VBZ,VBN,IN,NNP,CC,NNP,NNP,.","O,O,O,CITY,CITY,O,O,O,O,O,O,O,O,O,O,CITY,O,STATE_OR_PROVINCE,STATE_OR_PROVINCE,O","B-VP,B-SBAR,B-PP,B-NP,I-NP,O,B-NP,B-NP,I-NP,O,B-NP,I-NP,B-VP,I-VP,B-PP,B-NP,I-NP,I-NP,I-NP,O"
E:1159456397,spread of the infection within the population as a function of time,hong kong,4,"Various consequences of the spreading pattern of this double epidemic hypothesis are discussed in relation with the puzzling distribution of the disease in Mainland China , noticeably , in the huge difference witnessed between the situation in Beijing and in Shanghai ( both regions have tight and frequent contacts with Guangdong and Hong Kong ) .","JJ,NNS,IN,DT,NN,NN,IN,DT,JJ,JJ,NN,VBP,VBN,IN,NN,IN,DT,JJ,NN,IN,DT,NN,IN,NNP,NNP,,,RB,,,IN,DT,JJ,NN,VBD,IN,DT,NN,IN,NNP,CC,IN,NNP,-LRB-,CC,NNS,VBP,JJ,CC,JJ,NNS,IN,NNP,CC,NNP,NNP,-RRB-,.","O,O,O,O,O,O,O,O,O,O,O,O,O,O,O,O,O,O,O,O,O,CAUSE_OF_DEATH,O,LOCATION,COUNTRY,O,O,O,O,O,O,O,O,O,O,O,O,CITY,O,O,CITY,O,O,O,O,O,O,O,O,O,STATE_OR_PROVINCE,O,CITY,CITY,O,O","B-NP,I-NP,B-PP,B-NP,I-NP,I-NP,B-PP,B-NP,I-NP,I-NP,I-NP,B-VP,I-VP,B-PP,B-NP,B-PP,B-NP,I-NP,I-NP,B-PP,B-NP,I-NP,B-PP,B-NP,I-NP,O,B-ADVP,O,B-PP,B-NP,I-NP,I-NP,B-VP,B-PP,B-NP,I-NP,B-PP,B-NP,B-PP,B-PP,B-NP,I-NP,I-NP,I-NP,B-VP,B-NP,I-NP,I-NP,I-NP,B-PP,B-NP,O,O,O,O,O"
E:1590668142,"class of Susceptibles, S,",hong kong,9,"Various consequences of the spreading pattern of this double epidemic hypothesis are discussed in relation with the puzzling distribution of the disease in Mainland China , noticeably , in the huge difference witnessed between the situation in Beijing and in Shanghai ( both regions have tight and frequent contacts with Guangdong and Hong Kong ) .","JJ,NNS,IN,DT,NN,NN,IN,DT,JJ,JJ,NN,VBP,VBN,IN,NN,IN,DT,JJ,NN,IN,DT,NN,IN,NNP,NNP,,,RB,,,IN,DT,JJ,NN,VBD,IN,DT,NN,IN,NNP,CC,IN,NNP,-LRB-,CC,NNS,VBP,JJ,CC,JJ,NNS,IN,NNP,CC,NNP,NNP,-RRB-,.","O,O,O,O,O,O,O,O,O,O,O,O,O,O,O,O,O,O,O,O,O,CAUSE_OF_DEATH,O,LOCATION,COUNTRY,O,O,O,O,O,O,O,O,O,O,O,O,CITY,O,O,CITY,O,O,O,O,O,O,O,O,O,STATE_OR_PROVINCE,O,CITY,CITY,O,O","B-NP,I-NP,B-PP,B-NP,I-NP,I-NP,B-PP,B-NP,I-NP,I-NP,I-NP,B-VP,I-VP,B-PP,B-NP,B-PP,B-NP,I-NP,I-NP,B-PP,B-NP,I-NP,B-PP,B-NP,I-NP,O,B-ADVP,O,B-PP,B-NP,I-NP,I-NP,B-VP,B-PP,B-NP,I-NP,B-PP,B-NP,B-PP,B-PP,B-NP,I-NP,I-NP,I-NP,B-VP,B-NP,I-NP,I-NP,I-NP,B-PP,B-NP,O,O,O,O,O"
E:-2099349734,set of coronavirus mediated epidemics that affected pigs,hong kong,3,"BMC Infectious Diseases 2003 , 3 background infection level , that remained present in Guangdong for a long time and witnessed a slow decline in Hong Kong , on which superimposes sudden local outbreaks .","NNP,JJ,NNS,CD,,,CD,NN,NN,NN,,,WDT,VBD,JJ,IN,NNP,IN,DT,JJ,NN,CC,VBD,DT,JJ,NN,IN,NNP,NNP,,,IN,WDT,VBZ,JJ,JJ,NNS,.","O,O,CAUSE_OF_DEATH,DATE,O,NUMBER,O,CAUSE_OF_DEATH,O,O,O,O,DATE,O,STATE_OR_PROVINCE,O,O,O,O,O,O,O,O,O,O,CITY,CITY,O,O,O,O,O,O,O,O","B-NP,I-NP,I-NP,I-NP,I-NP,I-NP,I-NP,I-NP,I-NP,O,B-NP,B-VP,B-ADJP,B-PP,B-NP,B-PP,B-NP,I-NP,I-NP,O,B-VP,B-NP,I-NP,I-NP,B-PP,B-NP,I-NP,O,B-PP,B-NP,B-VP,B-NP,I-NP,I-NP,O"
